{
  "schema_version": 1,
  "order_id": "8d2e1b63-4c0e-5f7b-9a32-7e5c0b1d2f88",
  "created_at": "2026-10-16T09:00:00Z",
  "proposed_by": "planner",
  "protocol": "morpho-blue",
  "function": "supply",
  "token": "USDC",
  "amount": {
    "value": "25000000",
    "decimals": 6
  },
  "market": "usdc-cbeth",
  "recipient": "self"
}
