{
  "schema_version": 1,
  "order_id": "8d3e2b1a-4c5f-6a7b-8c9d-0e1f2a3b4c5d",
  "created_at": "2026-10-16T09:00:00Z",
  "proposed_by": "planner",
  "protocol": "aave-stata",
  "function": "supply",
  "token": "USDC",
  "amount": {
    "value": "10000000",
    "decimals": 6
  },
  "recipient": "self"
}
