{
  "schema_version": 1,
  "order_id": "7c1f0a52-3b9d-4e6a-8f21-6d4b9a0c1e77",
  "created_at": "2026-10-16T09:00:00Z",
  "proposed_by": "planner",
  "protocol": "morpho-blue",
  "function": "supply",
  "token": "USDC",
  "amount": {
    "value": "25000000",
    "decimals": 6
  },
  "market": "usdc-wbtc",
  "recipient": "self"
}
