{
  "schema_version": 1,
  "order_id": "8e4d2a1b-3c5f-4a76-9e12-8b2a0c7d3f59",
  "created_at": "2026-10-16T12:00:00Z",
  "proposed_by": "planner",
  "protocol": "uniswap-v3",
  "function": "exactInputSingle",
  "token": "USDC",
  "amount": {
    "value": "10000000",
    "decimals": 6
  },
  "recipient": "self",
  "token_out": "WBTC",
  "max_slippage_bps": 50
}
