{
  "schema_version": 1,
  "order_id": "2e9a4d32-1c5f-6e7a-0d3b-4a9f5e2c6d73",
  "created_at": "2026-10-16T09:00:00Z",
  "proposed_by": "owner",
  "protocol": "wallet",
  "function": "transfer",
  "token": "ETH",
  "amount": {
    "value": "100000000000000000",
    "decimals": 18
  },
  "recipient": "owner"
}
